"Authors","Author full names","Author(s) ID","Title","Year","Source title","Cited by","DOI","Link","Abstract","PubMed ID","Document Type","Publication Stage","Open Access","Source"
"Arrivillaga, M.; Bermúdez, P.C.; Garcia-Cifuentes, J.P.; Vargas-Cardona, H.D.; Neira, D.; del Mar Torres, M.; Rodriguez-Lopez, M.; Morales, D.; Arizala, B.","Arrivillaga, Marcela (35241931900); Bermúdez, Paula C. (57218656175); Garcia-Cifuentes, Juan Pablo (57211334564); Vargas-Cardona, Hernán Darío (55516207600); Neira, Daniela (58134954000); del Mar Torres, Maria (59424124800); Rodriguez-Lopez, Mérida Rosa (56577971200); Morales, Daniela (57191985651); Arizala, Bleider (59424165600)","35241931900; 57218656175; 57211334564; 55516207600; 58134954000; 59424124800; 56577971200; 57191985651; 59424165600","Designing CITOBOT: A portable device for cervical cancer screening using human-centered design, smart prototyping, and artificial intelligence","2024","Computational and Structural Biotechnology Journal","3","10.1016/j.csbj.2024.11.018","https://www.scopus.com/inward/record.uri?eid=2-s2.0-85210117745&doi=10.1016%2Fj.csbj.2024.11.018&partnerID=40&md5=d9655300d2646a2df386b9933175e2d2","Cervical cancer remains a leading cause of mortality in its invasive stages, presenting a significant global public health challenge, particularly in low- and middle-income countries. Despite technological advancements that have improved the quality of cervical images captured during visual inspections, several challenges persist. This article presents key findings from the CITOBOT-COL translational research project, a large-scale initiative focused on designing CITOBOT as a portable cervical cancer screening device. We detail the comprehensive technological development of CITOBOT, guided by a human-centered design approach, smart prototyping, and the integration of AI. Over four design iterations, we developed and refined CITOBOT v4, a portable device. Prototypes were validated through focus groups and testing by experts in cervical cancer prevention, gynecology, nursing, software, artificial intelligence, computer engineering, and public health, utilizing various anatomical models at the Simulated Hospital Laboratory of Pontificia Universidad Javeriana Cali, Colombia. Additionally, we developed AI algorithms using the Inception V3 network, optimized with Transfer Learning and Fine Tuning, for cervical image classification and offline-operating software that guides the physician through the examination and provides a risk assessment for cervical cancer. Feedback was crucial in assessing and refining the device's functionality, focusing on capturing high-quality cervical images. The development of CITOBOT v4 highlights the importance of fostering innovation in resource-limited settings, offering an effective solution to improve cervical cancer screening and potentially save lives in vulnerable communities. © 2024 The Authors","","Article","Final","All Open Access; Gold Open Access; Green Accepted Open Access; Green Open Access","Scopus"
"Song, J.; Wang, L.; Yan, J.; Feng, Y.; Zhang, Y.","Song, Jiayu (57218448833); Wang, Le (57196330884); Yan, Jiazhuo (57224993167); Feng, Yue (57203740957); Zhang, Yunyan (54583010700)","57218448833; 57196330884; 57224993167; 57203740957; 54583010700","Enhancing cervical precancerous lesion detection using African Vulture Optimization Algorithm with Deep Learning model","2024","Biomedical Signal Processing and Control","4","10.1016/j.bspc.2024.106665","https://www.scopus.com/inward/record.uri?eid=2-s2.0-85199432049&doi=10.1016%2Fj.bspc.2024.106665&partnerID=40&md5=b616a40967b13fcbffa1864a9a4e33d3","Cervical cancer (CC) is a major cause of mortality among women, mainly in emerging countries, including India. Recent technological advancements have the potential to enable quick, cost-effective, and more sensitive screening and treatment measures for CC. Consequently, deep learning (DL)-based approaches have gained importance in classifying CC patients into distinct risk groups. This study proposes an African Vulture Optimization Algorithm with Deep Learning assisted Cervical Cancer Detection (AVOADL-CCD) technique. The AVOADL-CCD technique follows Wiener filtering for image pre-processing. Besides, the AVOADL-CCD technique applies Capsule Networks (CapsNet) model for deriving feature vectors. The AVOA can be applied to the CapsNet model for the hyperparameter tuning process. For the automated recognition and classification of CC, an adaptive neuro-fuzzy inference system (ANFIS) model can be exploited. The experimental outcomes of the AVOADL-CCD method take place on the Herlev dataset. The simulation values show the enhanced detection results of the AVOADL-CCD algorithm over existing techniques with a maximum accuracy of 99.53%. © 2024","","Article","Final","All Open Access; Hybrid Gold Open Access","Scopus"
"Rönnau, M.M.; Lepper, T.W.; Guedes, I.C.; Espinosa, A.L.F.; Rados, P.V.; De Oliveira Neto, M.M.","Rönnau, Maikel Maciel (58000615900); Lepper, Tatiana Wannmacher (58591813600); Guedes, I. C. (59248660200); Espinosa, Ana Laura Ferrares (59248660300); Rados, P. V. (55667503500); De Oliveira Neto, Manuel Menezes (10141769500)","58000615900; 58591813600; 59248660200; 59248660300; 55667503500; 10141769500","Automatic segmentation and classification of Papanicolaou-stained cells and dataset for oral cancer detection","2024","Computers in Biology and Medicine","5","10.1016/j.compbiomed.2024.108967","https://www.scopus.com/inward/record.uri?eid=2-s2.0-85200597131&doi=10.1016%2Fj.compbiomed.2024.108967&partnerID=40&md5=b21e0f95112a741963a172f9eb7303da","Background and Objective: Papanicolaou staining has been successfully used to assist early detection of cervix cancer for several decades. We postulate that this staining technique can also be used for assisting early detection of oral cancer, which is responsible for about 300,000 deaths every year. The rational for such claim includes two key observations: (i) nuclear atypia, i.e., changes in volume, shape, and staining properties of the cell nuclei can be linked to rapid cell proliferation and genetic instability; and (ii) Papanicolaou staining allows one to reliably segment cells’ nuclei and cytoplasms. While Papanicolaou staining is an attractive tool due to its low cost, its interpretation requires a trained pathologist. Our goal is to automate the segmentation and classification of morphological features needed to evaluate the use of Papanicolaou staining for early detection of mouth cancer. Methods: We built a convolutional neural network (CNN) for automatic segmentation and classification of cells in Papanicolaou-stained images. Our CNN was trained and evaluated on a new image dataset of cells from oral mucosa consisting of 1,563 Full HD images from 52 patients, annotated by specialists. The effectiveness of our model was evaluated against a group of experts. Its robustness was also demonstrated on five public datasets of cervical images captured with different microscopes and cameras, and having different resolutions, colors, background intensities, and noise levels. Results: Our CNN model achieved expert-level performance in a comparison with a group of three human experts on a set of 400 Papanicolaou-stained images of the oral mucosa from 20 patients. The results of this experiment exhibited high Interclass Correlation Coefficient (ICC) values. Despite being trained on images from the oral mucosa, it produced high-quality segmentation and plausible classification for five public datasets of cervical cells. Our Papanicolaou-stained image dataset is the most diverse publicly available image dataset for the oral mucosa in terms of number of patients. Conclusion: Our solution provides the means for exploring the potential of Papanicolaou-staining as a powerful and inexpensive tool for early detection of oral cancer. We are currently using our system to detect suspicious cells and cell clusters in oral mucosa slide images. Our trained model, code, and dataset are available and can help practitioners and stimulate research in early oral cancer detection. © 2024 Elsevier Ltd","39111154","Article","Final","","Scopus"
"Elayaraja, P.; Kumarganesh, S.; Martin Sagayam, K.M.; Jeyabose, J.","Elayaraja, P. (57205232992); Kumarganesh, S. (56826097300); Martin Sagayam, K. (56938711400); Jeyabose, Andrew A. (57214601875)","57205232992; 56826097300; 56938711400; 57214601875","An automated cervical cancer diagnosis using genetic algorithm and CANFIS approaches","2024","Technology and Health Care","3","10.3233/THC-230926","https://www.scopus.com/inward/record.uri?eid=2-s2.0-85198683428&doi=10.3233%2FTHC-230926&partnerID=40&md5=02253d168eb97c7e4e43bca8422a1295","BACKGROUND: Cervical malignancy is considered among the most perilous cancers affecting women in numerous East African and South Asian nations, both in terms of its prevalence and fatality rates. OBJECTIVE: This research aims to propose an efficient automated system for the segmentation of cancerous regions in cervical images. METHODS: The proposed techniques encompass preprocessing, feature extraction with an optimized feature set, classification, and segmentation. The original cervical image undergoes smoothing using the Gaussian Filter technique, followed by the extraction of Local Binary Pattern (LBP) and Grey Level Co-occurrence Matrix (GLCM) features from the enhanced cervical images. LBP features capture pixel relationships within a mask window, while GLCM features quantify energy metrics across all pixels in the images. These features serve to distinguish normal cervical images from abnormal ones. The extracted features are optimized using Genetic Algorithm (GA) as an optimization method, and the optimized sets of features are classified using the Co-Active Adaptive Neuro-Fuzzy Inference System (CANFIS) classification method. Subsequently, a morphological segmentation technique is employed to categorize irregular cervical images, identifying and segmenting malignant regions within them. RESULTS: The proposed approach achieved a sensitivity of 99.09%, specificity of 99.39%, and accuracy of 99.36%. CONCLUSION: The proposed approach demonstrated superior performance compared to state-of-The-Art techniques, and the results have been validated by expert radiologists. © 2024-IOS Press. All rights reserved.","38251073","Article","Final","","Scopus"
"Xin, W.; Rixin, S.; Linrui, L.; Zhihui, Q.; Long, L.; Zhang, Z.","Xin, Wang (57935476500); Rixin, Su (59139021300); Linrui, Li (56387550700); Zhihui, Qin (58664021400); Long, Liu (57869992400); Zhang, Yu (57226580940)","57935476500; 59139021300; 56387550700; 58664021400; 57869992400; 57226580940","Machine learning-based radiomics for predicting outcomes in cervical cancer patients undergoing concurrent chemoradiotherapy","2024","Computers in Biology and Medicine","23","10.1016/j.compbiomed.2024.108593","https://www.scopus.com/inward/record.uri?eid=2-s2.0-85193966977&doi=10.1016%2Fj.compbiomed.2024.108593&partnerID=40&md5=70074a8a5da6f4038ec4c47bea5d4ead","Purposes: To investigate the value of machine learning-based radiomics for predicting disease-free survival (DFS) and overall survival (OS) undergoing concurrent chemoradiotherapy (CCRT) for patients with locally advanced cervical cancer (LACC). Materials and methods: In this multicentre study, 700 patients with IB2-IVA cervical cancer who underwent CCRT with ongoing follow-up were retrospectively analyzed. Three-dimensional radiomics features of primary lesions and its surrounding 5 mm region in T2WI sequences were collected. Six machine learning methods were used to construct the optimal radiomics model for accurate prediction of DFS and OS after CCRT in LACC patients. Eventually, TCGA and GEO databases were used to explore the mechanisms of radiomics in predicting the progression and survival of cervical cancer. This study adhered CLEAR for reporting and its quality was assessed using RQS and METRICS. Results: In the prediction of DFS, the RSF model combined tumor and peritumor radiomics demonstrated the best predictive efficacy, with the AUC for predicting 1-year, 3-year, and 5-year DFS in the training, validation, and test sets of 0.986, 0.989, 0.990, and 0.884, 0.838, 0.823, and 0.829, 0.809, 0.841, respectively. In the prediction of OS, the GBM model best performer, with AUC of 0.999, 0.995, 0.978, and 0.981, 0.975, 0.837, and 0.904, 0.860, 0.905. Differential genes in TCGA and GEO suggest that the prediction of radiomics model may be associated with KDELR2 and HK2. Conclusion: Machine learning-based radiomics models help to predict DFS and OS after CCRT in LACC patients, and the combination of tumor and peritumor information has higher predictive efficacy, which can provide a reliable basis for therapeutic decision-making in cervical cancer patients. © 2024 Elsevier Ltd","38801795","Article","Final","","Scopus"
"Tang, D.; Li, C.; Du, T.; Jiang, H.; Ma, D.; Ma, Z.; Grzegorzek, M.; Jiang, T.; Sun, H.","Tang, Dechao (58023452200); Li, Chen (56344405800); Du, Tianming (58546817800); Jiang, Huiyan (14628756900); Ma, Deguo (58022159000); Ma, Zhiyu (58023019900); Grzegorzek, Marcin Jerzy (6504608152); Jiang, Tao (56441962300); Sun, Hongzan (55446337100)","58023452200; 56344405800; 58546817800; 14628756900; 58022159000; 58023019900; 6504608152; 56441962300; 55446337100","ECPC-IDS: A benchmark endometrial cancer PET/CT image dataset for evaluation of semantic segmentation and detection of hypermetabolic regions","2024","Computers in Biology and Medicine","10","10.1016/j.compbiomed.2024.108217","https://www.scopus.com/inward/record.uri?eid=2-s2.0-85186540522&doi=10.1016%2Fj.compbiomed.2024.108217&partnerID=40&md5=c55f875772edc213c83379343f9773e8","Background: Endometrial cancer is one of the most common tumors in the female reproductive system and is the third most common gynecological malignancy that causes death after ovarian and cervical cancer. Early diagnosis can significantly improve the 5-year survival rate of patients. With the development of artificial intelligence, computer-assisted diagnosis plays an increasingly important role in improving the accuracy and objectivity of diagnosis and reducing the workload of doctors. However, the absence of publicly available image datasets restricts the application of computer-assisted diagnostic techniques. Methods: In this paper, a publicly available Endometrial Cancer PET/CT Image Dataset for Evaluation of Semantic Segmentation and Detection of Hypermetabolic Regions (ECPC-IDS) are published. Specifically, the segmentation section includes PET and CT images, with 7159 images in multiple formats totally. In order to prove the effectiveness of segmentation on ECPC-IDS, six deep learning semantic segmentation methods are selected to test the image segmentation task. The object detection section also includes PET and CT images, with 3579 images and XML files with annotation information totally. Eight deep learning methods are selected for experiments on the detection task. Results: This study is conduct using deep learning-based semantic segmentation and object detection methods to demonstrate the distinguishability on ECPC-IDS. From a separate perspective, the minimum and maximum values of Dice on PET images are 0.546 and 0.743, respectively. The minimum and maximum values of Dice on CT images are 0.012 and 0.510, respectively. The target detection section's maximum mAP values on PET and CT images are 0.993 and 0.986, respectively. Conclusion: As far as we know, this is the first publicly available dataset of endometrial cancer with a large number of multi-modality images. ECPC-IDS can assist researchers in exploring new algorithms to enhance computer-assisted diagnosis, benefiting both clinical doctors and patients. ECPC-IDS is also freely published for non-commercial at: https://figshare.com/articles/dataset/ECPC-IDS/23808258. © 2024 Elsevier Ltd","38430743","Article","Final","","Scopus"
"Stegmuller, T.; Abbet, C.; Bozorgtabar, B.; Clarke, H.; Petignat, P.; Vassilakos, P.; Thiran, J.-P.","Stegmuller, Thomas (57462254700); Abbet, Christian (57211191066); Bozorgtabar, Behzad (37109488100); Clarke, Holly (58112080900); Petignat, P. P. (7003287570); Vassilakos, Pierre P. (7005228217); Thiran, Jean-Philippe Philippe H. (35554798200)","57462254700; 57211191066; 37109488100; 58112080900; 7003287570; 7005228217; 35554798200","Self-supervised learning-based cervical cytology for the triage of HPV-positive women in resource-limited settings and low-data regime","2024","Computers in Biology and Medicine","9","10.1016/j.compbiomed.2023.107809","https://www.scopus.com/inward/record.uri?eid=2-s2.0-85184523266&doi=10.1016%2Fj.compbiomed.2023.107809&partnerID=40&md5=f48842fd2c535540f1277b483d14fe35","Screening Papanicolaou test samples has proven to be highly effective in reducing cervical cancer-related mortality. However, the lack of trained cytopathologists hinders its widespread implementation in low-resource settings. Deep learning-assisted telecytology diagnosis emerges as an appealing alternative, but it requires the collection of large annotated training datasets, which is costly and time-consuming. In this paper, we demonstrate that the abundance of unlabeled images that can be extracted from Pap smear test whole slide images presents a fertile ground for self-supervised learning methods, yielding performance improvements compared to off-the-shelf pre-trained models for various downstream tasks. In particular, we propose Cervical Cell Copy-Pasting (C3P) as an effective augmentation method, which enables knowledge transfer from public and labeled single-cell datasets to unlabeled tiles. Not only does C3P outperforms naive transfer from single-cell images, but we also demonstrate its advantageous integration into multiple instance learning methods. Importantly, all our experiments are conducted on our introduced in-house dataset comprising liquid-based cytology Pap smear images obtained using low-cost technologies. This aligns with our long-term objective of deep learning-assisted telecytology for diagnosis in low-resource settings. © 2024 The Authors","38113684","Article","Final","All Open Access; Green Accepted Open Access; Green Final Open Access; Green Open Access; Hybrid Gold Open Access","Scopus"
"Ye, Y.; Li, M.; Pan, Q.; Fang, X.; Yang, H.; Dong, B.; Yang, J.; Zheng, Y.; Zhang, R.; Liao, Z.","Ye, Ying (57221916018); Li, Meng (58753764800); Pan, Qilong (58753630200); Fang, Xin (58358090000); Yang, Hong (58602559100); Dong, Bingying (58303740100); Yang, Jiaying (58302856100); Zheng, Yuan (58753764900); Zhang, Renxiang (58753630300); Liao, Zhijun (57190954823)","57221916018; 58753764800; 58753630200; 58358090000; 58602559100; 58303740100; 58302856100; 58753764900; 58753630300; 57190954823","Machine learning-based classification of deubiquitinase USP26 and its cell proliferation inhibition through stabilizing KLF6 in cervical cancer","2024","Computers in Biology and Medicine","6","10.1016/j.compbiomed.2023.107745","https://www.scopus.com/inward/record.uri?eid=2-s2.0-85179131176&doi=10.1016%2Fj.compbiomed.2023.107745&partnerID=40&md5=de01aebc453586afa62163536d0fc6a5","Objective: We aim to accurately distinguish ubiquitin-specific proteases (USPs) from other members within the deubiquitinating enzyme families based on protein sequences. Additionally, we seek to elucidate the specific regulatory mechanisms through which USP26 modulates Krüppel-like factor 6 (KLF6) and assess the subsequent effects of this regulation on both the proliferation and migration of cervical cancer cells. Methods: All the deubiquitinase (DUB) sequences were classified into USPs and non-USPs. Feature vectors, including 188D, n-gram, and 400D dimensions, were extracted from these sequences and subjected to binary classification via the Weka software. Next, thirty human USPs were also analyzed to identify conserved motifs and ascertained evolutionary relationships. Experimentally, more than 90 unique DUB-encoding plasmids were transfected into HeLa cell lines to assess alterations in KLF6 protein levels and to isolate a specific DUB involved in KLF6 regulation. Subsequent experiments utilized both wild-type (WT) USP26 overexpression and shRNA-mediated USP26 knockdown to examine changes in KLF6 protein levels. The half-life experiment was performed to assess the influence of USP26 on KLF6 protein stability. Immunoprecipitation was applied to confirm the USP26-KLF6 interaction, and ubiquitination assays to explore the role of USP26 in KLF6 deubiquitination. Additional cellular assays were conducted to evaluate the effects of USP26 on HeLa cell proliferation and migration. Results: 1. Among the extracted feature vectors of 188D, 400D, and n-gram, all 12 classifiers demonstrated excellent performance. The RandomForest classifier demonstrated superior performance in this assessment. Phylogenetic analysis of 30 human USPs revealed the presence of nine unique motifs, comprising zinc finger and ubiquitin-specific protease domains. 2. Through a systematic screening of the deubiquitinase library, USP26 was identified as the sole DUB associated with KLF6. 3. USP26 positively regulated the protein level of KLF6, as evidenced by the decrease in KLF6 protein expression upon shUSP26 knockdown in both 293T and Hela cell lines. Additionally, half-life experiments demonstrated that USP26 prolonged the stability of KLF6. 4. Immunoprecipitation experiments revealed a strong interaction between USP26 and KLF6. Notably, the functional interaction domain was mapped to amino acids 285–913 of USP26, as opposed to the 1–295 region. 5. WT USP26 was found to attenuate the ubiquitination levels of KLF6. However, the mutant USP26 abrogated its deubiquitination activity. 6. Functional biological assays demonstrated that overexpression of USP26 inhibited both proliferation and migration of HeLa cells. Conversely, knockdown of USP26 was shown to promote these oncogenic properties. Conclusions: 1. At the protein sequence level, members of the USP family can be effectively differentiated from non-USP proteins. Furthermore, specific functional motifs have been identified within the sequences of human USPs. 2. The deubiquitinating enzyme USP26 has been shown to target KLF6 for deubiquitination, thereby modulating its stability. Importantly, USP26 plays a pivotal role in the modulation of proliferation and migration in cervical cancer cells. © 2023 Elsevier Ltd","38064851","Article","Final","","Scopus"
"Xu, T.; Jiang, J.; Xiang, X.; Jahanshahi, H.; Zhang, Y.; Chen, X.; Li, L.","Xu, Tu (58738372000); Jiang, Jingwen (58735958000); Xiang, Xiaoqing (58081387000); Jahanshahi, Hadi (57193898012); Zhang, Yong (59072021800); Chen, Xiaoyan (57202604619); Li, Lesai (55646573000)","58738372000; 58735958000; 58081387000; 57193898012; 59072021800; 57202604619; 55646573000","Conduction and validation of a novel prognostic signature in cervical cancer based on the necroptosis characteristic genes via integrating of multiomics data","2024","Computers in Biology and Medicine","7","10.1016/j.compbiomed.2023.107656","https://www.scopus.com/inward/record.uri?eid=2-s2.0-85178381205&doi=10.1016%2Fj.compbiomed.2023.107656&partnerID=40&md5=3ca0e7bc9caca3075a1c1b880f7601aa","The significance of necroptosis in recurrent or metastatic cervical cancer remains unclear. In this study, we utilized various bioinformatics methods to analyze the cancer genome atlas (TCGA) data, gene chip and the single-cell RNA-sequencing (scRNA seq) data. And a necroptosis-related genes signature for prognostic assessment of patients with cervical cancer was constructed successfully. Survival analysis, receiver operating characteristic (ROC) curve, the support vector machine recursive feature elimination (SVM-RFE) algorithm and random forest analysis were performed to validate this signature. Patients in TCGA-CESC cohort were grouped into “high-necroptosis score (H-NCPS)"" vs “low-necroptosis score (L-NCPS)"" subgroups based on the median of necroptosis score of each patient. Analyses of the tumor microenvironment manifested “H-NCPS” patients associated with lower degree of immune infiltration. Through the utilization of survival analysis, cell communication, and Gene Set Enrichment Analysis (GSEA), PGK1 was determined to be the pivotal gene within the 9-gene signature associated with necroptosis. The high expression of PGK1 in cervical cancer cells was confirmed through the utilization of quantitative real-time polymerase chain reaction (RT-qPCR) and the human protein atlas (HPA). In the interim, PGK1 prompted the transition of M1 macrophages to M2 macrophages and influenced the occurrence and development of necroptosis. In conclusion, the 9-gene signature developed from necroptosis-related genes has shown significant predictive capabilities for the prognosis of cervical cancer, offered valuable guidance for individualized and targeted treatment approaches for patients. © 2023 Elsevier Ltd","38029530","Article","Final","","Scopus"
